<?xml version="1.0" encoding="utf-8"?>
<!DOCTYPE list SYSTEM "spawn.dtd">
<list>
	<spawn name="[ssqteleport1_1612_31]">
		<npc id="31865" count="1" respawn="60" pos="-111971 -182437 -6755 0" />	
	</spawn>
	<spawn name="[ssqteleport1_1612_32]">
		<npc id="31866" count="1" respawn="60" pos="-111098 -182451 -6755 0" />	
	</spawn>
	<spawn name="[ssqteleport1_1612_33]">
		<npc id="31867" count="1" respawn="60" pos="-110274 -180570 -6755 0" />	
	</spawn>
	<spawn name="[ssqteleport1_1612_34]">
		<npc id="31868" count="1" respawn="60" pos="-109391 -180543 -6755 0" />	
	</spawn>
	<spawn name="[ssqteleport1_1612_35]">
		<npc id="31869" count="1" respawn="60" pos="-113276 -181523 -6755 0" />	
	</spawn>
	<spawn name="[ssqteleport1_1612_36]">
		<npc id="31870" count="1" respawn="60" pos="-111564 -180548 -6753 0" />	
	</spawn>
	<spawn name="[ssqteleport1_1612_37]">
		<npc id="31871" count="1" respawn="60" pos="-109782 -182443 -6755 0" />	
	</spawn>
	<spawn name="[ssqteleport1_1612_38]">
		<npc id="31872" count="1" respawn="60" pos="-111571 -181523 -6755 0" />	
	</spawn>
	<spawn name="[ssqteleport1_mb1612_39]">
		<npc id="31873" count="1" respawn="60" pos="-109884 -181517 -6755 0" />	
	</spawn>
	<spawn name="[ssqteleport1_1612_41]">
		<npc id="31874" count="1" respawn="60" pos="-111974 -179611 -6755 0" />	
	</spawn>
	<spawn name="[ssqteleport1_1612_42]">
		<npc id="31875" count="1" respawn="60" pos="-111102 -179625 -6755 0" />	
	</spawn>
	<spawn name="[ssqteleport1_1612_43]">
		<npc id="31876" count="1" respawn="60" pos="-110277 -177744 -6755 0" />	
	</spawn>
	<spawn name="[ssqteleport1_1612_44]">
		<npc id="31877" count="1" respawn="60" pos="-109395 -177716 -6755 0" />	
	</spawn>
	<spawn name="[ssqteleport1_1612_45]">
		<npc id="31878" count="1" respawn="60" pos="-113280 -178697 -6755 0" />	
	</spawn>
	<spawn name="[ssqteleport1_1612_46]">
		<npc id="31879" count="1" respawn="60" pos="-111567 -177721 -6753 0" />	
	</spawn>
	<spawn name="[ssqteleport1_1612_47]">
		<npc id="31880" count="1" respawn="60" pos="-109785 -179617 -6755 0" />	
	</spawn>
	<spawn name="[ssqteleport1_1612_48]">
		<npc id="31881" count="1" respawn="60" pos="-111574 -178697 -6755 0" />	
	</spawn>
	<spawn name="[ssqteleport1_mb1612_49]">
		<npc id="31882" count="1" respawn="60" pos="-109888 -178691 -6755 0" />	
	</spawn>
	<spawn name="[ssqteleport1_1612_51]">
	    <npc id="31883" count="1" respawn="60" pos="-113797 -175816 -6755 0" />	
	</spawn>
	<spawn name="[ssqteleport1_1612_52]">
		<npc id="31884" count="1" respawn="60" pos="-114077 -174938 -6755 0" />	
	</spawn>
	<spawn name="[ssqteleport1_1612_53]">
		<npc id="31885" count="1" respawn="60" pos="-115705 -174147 -6755 0" />	
	</spawn>
	<spawn name="[ssqteleport1_1612_54]">
		<npc id="31886" count="1" respawn="60" pos="-115681 -173229 -6755 0" />	
	</spawn>
	<spawn name="[ssqteleport1_1612_55]">
		<npc id="31887" count="1" respawn="60" pos="-114751 -177066 -6755 0" />	
	</spawn>
	<spawn name="[ssqteleport1_1612_56]">
		<npc id="31888" count="1" respawn="60" pos="-115690 -175409 -6755 0" />	
	</spawn>
	<spawn name="[ssqteleport1_1612_57]">
		<npc id="31889" count="1" respawn="60" pos="-113805 -173604 -6755 0" />	
	</spawn>
	<spawn name="[ssqteleport1_1612_58]">
		<npc id="31890" count="1" respawn="60" pos="-114724 -175385 -6755 0" />	
	</spawn>
	<spawn name="[ssqteleport1_mb1612_59]">
		<npc id="31891" count="1" respawn="60" pos="-114723 -173724 -6755 0" />	
	</spawn>
	<spawn name="[ssqteleport1_1612_61]">
		<npc id="31892" count="1" respawn="60" pos="-117634 -177784 -6755 0" />	
	</spawn>
	<spawn name="[ssqteleport1_1612_62]">
		<npc id="31893" count="1" respawn="60" pos="-118465 -177758 -6755 0" />	
	</spawn>
	<spawn name="[ssqteleport1_1612_63]">
		<npc id="31894" count="1" respawn="60" pos="-119262 -179660 -6755 0" />	
	</spawn>
	<spawn name="[ssqteleport1_1612_64]">
		<npc id="31895" count="1" respawn="60" pos="-120151 -179668 -6755 0" />	
	</spawn>
	<spawn name="[ssqteleport1_1612_65]">
		<npc id="31896" count="1" respawn="60" pos="-116326 -178729 -6755 0" />	
	</spawn>
	<spawn name="[ssqteleport1_1612_66]">
		<npc id="31897" count="1" respawn="60" pos="-117973 -179667 -6755 0" />	
	</spawn>
	<spawn name="[ssqteleport1_1612_67]">
		<npc id="31898" count="1" respawn="60" pos="-119753 -177759 -6755 0" />	
	</spawn>
	<spawn name="[ssqteleport1_1612_68]">
		<npc id="31899" count="1" respawn="60" pos="-117976 -178724 -6755 0" />	
	</spawn>
	<spawn name="[ssqteleport1_mb1612_69]">
		<npc id="31900" count="1" respawn="60" pos="-119679 -178707 -6755 0" />	
	</spawn>
	<spawn name="[ssqteleport1_1612_71]">
		<npc id="31901" count="1" respawn="60" pos="-117676 -180613 -6755 0" />	
	</spawn>
	<spawn name="[ssqteleport1_1612_72]">
		<npc id="31902" count="1" respawn="60" pos="-118506 -180587 -6755 0" />	
	</spawn>
	<spawn name="[ssqteleport1_1612_73]">
		<npc id="31903" count="1" respawn="60" pos="-119304 -182488 -6755 0" />	
	</spawn>
	<spawn name="[ssqteleport1_1612_74]">
		<npc id="31904" count="1" respawn="60" pos="-120193 -182497 -6755 0" />	
	</spawn>
	<spawn name="[ssqteleport1_1612_75]">
		<npc id="31905" count="1" respawn="60" pos="-116367 -181558 -6755 0" />	
	</spawn>
	<spawn name="[ssqteleport1_1612_76]">
		<npc id="31906" count="1" respawn="60" pos="-118015 -182496 -6755 0" />	
	</spawn>
	<spawn name="[ssqteleport1_1612_77]">
		<npc id="31907" count="1" respawn="60" pos="-119795 -180588 -6755 0" />	
	</spawn>
	<spawn name="[ssqteleport1_1612_78]">
		<npc id="31908" count="1" respawn="60" pos="-118017 -181553 -6755 0" />	
	</spawn>
	<spawn name="[ssqteleport1_mb1612_79]">
		<npc id="31909" count="1" respawn="60" pos="-119720 -181536 -6755 0" />	
	</spawn>
	<spawn name="[ssqteleport1_1612_81]">
		<npc id="31910" count="1" respawn="60" pos="-115720 -184407 -6755 0" />	
	</spawn>
	<spawn name="[ssqteleport1_1612_82]">
		<npc id="31911" count="1" respawn="60" pos="-115714 -185264 -6755 0" />	
	</spawn>
	<spawn name="[ssqteleport1_1612_83]">
		<npc id="31912" count="1" respawn="60" pos="-113830 -186056 -6755 0" />	
	</spawn>
	<spawn name="[ssqteleport1_1612_84]">
		<npc id="31913" count="1" respawn="60" pos="-113828 -186929 -6755 0" />	
	</spawn>
	<spawn name="[ssqteleport1_1612_85]">
		<npc id="31914" count="1" respawn="60" pos="-114797 -183022 -6755 0" />	
	</spawn>
	<spawn name="[ssqteleport1_1612_86]">
		<npc id="31915" count="1" respawn="60" pos="-113868 -184724 -6755 0" />	
	</spawn>
	<spawn name="[ssqteleport1_1612_87]">
		<npc id="31916" count="1" respawn="60" pos="-115704 -186503 -6755 0" />	
	</spawn>
	<spawn name="[ssqteleport1_1612_88]">
		<npc id="31917" count="1" respawn="60" pos="-114815 -184706 -6755 0" />	
	</spawn>
	<spawn name="[ssqteleport1_mb1612_89]">
		<npc id="31918" count="1" respawn="60" pos="-114803 -186399 -6755 0" />	
	</spawn>
	<spawn name="[ssqteleport1_npc1622_01]">
		<npc id="31488" count="1" respawn="60" pos="-114224 -181504 -6753 32768" />	
		<npc id="31489" count="1" respawn="60" pos="-114216 -178698 -6753 32768" />	
		<npc id="31490" count="1" respawn="60" pos="-114798 -178084 -6753 49152" />	
		<npc id="31491" count="1" respawn="60" pos="-115362 -178692 -6753 0" />	
		<npc id="31492" count="1" respawn="60" pos="-115364 -181517 -6753 0" />	
		<npc id="31493" count="1" respawn="60" pos="-114793 -182125 -6753 16384" />	
	</spawn>
</list>