<?xml version="1.0" encoding="utf-8"?>
<!DOCTYPE list SYSTEM "spawn.dtd">
<list>
	<spawn spawn_bydefault="true"  name="[oren01_qm2019_05]">
		<territory>	
			<location x="40444" y="68984" minz="-3548" maxz="-3148" />
			<location x="43596" y="68888" minz="-3548" maxz="-3148" />
			<location x="44672" y="69892" minz="-3548" maxz="-3148" />
			<location x="44072" y="71904" minz="-3548" maxz="-3148" />
			<location x="41112" y="70332" minz="-3548" maxz="-3148" />
		</territory>
		<npc id="27064" count="1" respawn="180" />	
	</spawn>
	<spawn spawn_bydefault="true"  name="[oren01_qm2019_06]">
		<territory>	
			<location x="33004" y="78680" minz="-3748" maxz="-3298" />
			<location x="37372" y="79728" minz="-3748" maxz="-3298" />
			<location x="38244" y="83040" minz="-3748" maxz="-3298" />
			<location x="33060" y="83048" minz="-3748" maxz="-3298" />
		</territory>
		<npc id="27065" count="1" respawn="180" />	
	</spawn>
	<spawn spawn_bydefault="true"  name="[oren01_qm2019_07]">
		<territory>	
			<location x="46508" y="89244" minz="-3772" maxz="-3372" />
			<location x="48304" y="90876" minz="-3772" maxz="-3372" />
			<location x="47488" y="92304" minz="-3772" maxz="-3372" />
			<location x="45004" y="92160" minz="-3772" maxz="-3372" />
		</territory>
		<npc id="27067" count="1" respawn="180" />	
	</spawn>
	<spawn spawn_bydefault="true"  name="[oren01_qm2019_08]">
		<territory>	
			<location x="56804" y="77312" minz="-3656" maxz="-3356" />
			<location x="58504" y="76840" minz="-3656" maxz="-3356" />
			<location x="58780" y="80240" minz="-3656" maxz="-3356" />
			<location x="56760" y="80072" minz="-3656" maxz="-3356" />
			<location x="56016" y="78784" minz="-3656" maxz="-3356" />
		</territory>
		<npc id="27068" count="1" respawn="180" />	
	</spawn>
	<spawn spawn_bydefault="true"  name="[oren01_qm2120_07]">
		<territory>	
			<location x="55560" y="89836" minz="-3784" maxz="-3384" />
			<location x="57188" y="89220" minz="-3784" maxz="-3384" />
			<location x="57756" y="90292" minz="-3784" maxz="-3384" />
			<location x="57132" y="91152" minz="-3784" maxz="-3384" />
			<location x="55936" y="91236" minz="-3784" maxz="-3384" />
		</territory>
		<npc id="27077" count="1" respawn="180" />	
	</spawn>
	<spawn spawn_bydefault="true"  name="[oren01_qm2120_08]">
		<territory>	
			<location x="49012" y="90172" minz="-3748" maxz="-3348" />
			<location x="50100" y="90600" minz="-3748" maxz="-3348" />
			<location x="50080" y="91664" minz="-3748" maxz="-3348" />
			<location x="49068" y="92144" minz="-3748" maxz="-3348" />
			<location x="48224" y="91148" minz="-3748" maxz="-3348" />
		</territory>
		<npc id="27077" count="1" respawn="180" />	
	</spawn>
	<spawn spawn_bydefault="true"  name="[oren01_qm2120_09]">
		<territory>	
			<location x="42452" y="92644" minz="-3716" maxz="-3316" />
			<location x="43616" y="92100" minz="-3716" maxz="-3316" />
			<location x="44404" y="93556" minz="-3716" maxz="-3316" />
			<location x="43788" y="94300" minz="-3716" maxz="-3316" />
		</territory>
		<npc id="27077" count="1" respawn="180" />	
	</spawn>
	<spawn spawn_bydefault="true"  name="[oren01_qm2120_10]">
		<territory>	
			<location x="38128" y="90112" minz="-3528" maxz="-3128" />
			<location x="39000" y="90512" minz="-3528" maxz="-3128" />
			<location x="38036" y="91784" minz="-3528" maxz="-3128" />
			<location x="37308" y="91120" minz="-3528" maxz="-3128" />
		</territory>
		<npc id="27077" count="1" respawn="180" />	
	</spawn>
	<spawn spawn_bydefault="true"  name="[oren01_qm2120_11]">
		<territory>	
			<location x="34424" y="89224" minz="-3640" maxz="-3240" />
			<location x="35572" y="89364" minz="-3640" maxz="-3240" />
			<location x="35276" y="90860" minz="-3640" maxz="-3240" />
			<location x="34104" y="90288" minz="-3640" maxz="-3240" />
		</territory>
		<npc id="27077" count="1" respawn="180" />	
	</spawn>
	<spawn spawn_bydefault="true"  name="[oren01_qm2120_12]">
		<territory>	
			<location x="45656" y="89260" minz="-3676" maxz="-3276" />
			<location x="46760" y="88600" minz="-3676" maxz="-3276" />
			<location x="47960" y="89840" minz="-3676" maxz="-3276" />
			<location x="46040" y="90272" minz="-3676" maxz="-3276" />
		</territory>
		<npc id="27077" count="1" respawn="180" />	
	</spawn>
	<spawn spawn_bydefault="true"  name="[oren06_npc2120_001]">
		<npc id="30749" count="1" respawn="60" pos="63906 74711 -3700 57344" />	
	</spawn>
	<spawn spawn_bydefault="true"  name="[oren06_npc2120_002]">
		<npc id="30371" count="1" respawn="60" pos="51210 82474 -3283 6000" />	
	</spawn>
	<spawn spawn_bydefault="true"  name="[oren02_npc2120_g01]">
		<territory>	
			<location x="46968" y="67420" minz="-3830" maxz="-2830" />
			<location x="56293" y="71007" minz="-3830" maxz="-2830" />
			<location x="57197" y="74981" minz="-3830" maxz="-2830" />
			<location x="41712" y="67386" minz="-3830" maxz="-2830" />
		</territory>
		<npc id="31033" count="1" respawn="60" />	
	</spawn>
	<spawn spawn_bydefault="true"  name="[oren02_npc2120_g02]">
		<territory>	
			<location x="56883" y="78715" minz="-3830" maxz="-3130" />
			<location x="59196" y="79451" minz="-3830" maxz="-3130" />
			<location x="59556" y="92906" minz="-3830" maxz="-3130" />
			<location x="51064" y="92339" minz="-3830" maxz="-3130" />
		</territory>
		<npc id="31033" count="1" respawn="60" />	
	</spawn>
	<spawn spawn_bydefault="true"  name="[oren02_npc2120_g03]">
		<territory>	
			<location x="33123" y="82418" minz="-3857" maxz="-3157" />
			<location x="39324" y="83590" minz="-3857" maxz="-3157" />
			<location x="45351" y="92922" minz="-3857" maxz="-3157" />
			<location x="33334" y="90321" minz="-3857" maxz="-3157" />
		</territory>
		<npc id="31033" count="1" respawn="60" />	
	</spawn>
	<spawn spawn_bydefault="true"  name="[oren02_npc2120_g04]">
		<territory>	
			<location x="32976" y="67413" minz="-3778" maxz="-3078" />
			<location x="36579" y="67531" minz="-3778" maxz="-3078" />
			<location x="37720" y="82930" minz="-3778" maxz="-3078" />
			<location x="33259" y="81928" minz="-3778" maxz="-3078" />
		</territory>
		<npc id="31033" count="1" respawn="60" />	
	</spawn>

</list>