<?xml version="1.0" encoding="utf-8"?>
<!DOCTYPE list SYSTEM "spawn.dtd">
<list>
	<spawn name="[aden10_2520_01]">
		<territory>	
			<location x="163964" y="65628" minz="-3784" maxz="-3584" />
			<location x="166260" y="65636" minz="-3784" maxz="-3584" />
			<location x="167916" y="66900" minz="-3784" maxz="-3584" />
			<location x="163984" y="66868" minz="-3784" maxz="-3584" />
		</territory>
		<npc id="20640" count="1" respawn="23" />	
		<npc id="20641" count="2" respawn="23" />	
		<npc id="20642" count="1" respawn="23" />	
	</spawn>
	<spawn name="[aden10_2520_02]">
		<territory>	
			<location x="163944" y="67316" minz="-3456" maxz="-3006" />
			<location x="166248" y="67240" minz="-3456" maxz="-3006" />
			<location x="167016" y="68020" minz="-3456" maxz="-3006" />
			<location x="166108" y="69692" minz="-3456" maxz="-3006" />
			<location x="163920" y="69628" minz="-3456" maxz="-3006" />
		</territory>
		<npc id="20640" count="1" respawn="23" />	
		<npc id="20641" count="2" respawn="23" />	
		<npc id="20642" count="1" respawn="23" />	
	</spawn>
	<spawn name="[aden10_2520_03]">
		<territory>	
			<location x="164036" y="69844" minz="-3172" maxz="-2822" />
			<location x="166152" y="70024" minz="-3172" maxz="-2822" />
			<location x="166604" y="72564" minz="-3172" maxz="-2822" />
			<location x="165796" y="73504" minz="-3172" maxz="-2822" />
			<location x="164032" y="73700" minz="-3172" maxz="-2822" />
		</territory>
		<npc id="20640" count="3" respawn="23" />	
		<npc id="20641" count="3" respawn="23" />	
		<npc id="20642" count="3" respawn="23" />	
	</spawn>
	<spawn name="[aden10_2520_04]">
		<territory>	
			<location x="164120" y="74116" minz="-3164" maxz="-2064" />
			<location x="165344" y="73908" minz="-3164" maxz="-2064" />
			<location x="166740" y="76632" minz="-3164" maxz="-2064" />
			<location x="166404" y="80164" minz="-3164" maxz="-2064" />
			<location x="163956" y="80052" minz="-3164" maxz="-2064" />
		</territory>
		<npc id="20643" count="2" respawn="23" />	
		<npc id="20644" count="3" respawn="23" />	
		<npc id="20645" count="2" respawn="23" />	
	</spawn>
	<spawn name="[aden10_2520_05]">
		<territory>	
			<location x="164120" y="80292" minz="-2464" maxz="-1864" />
			<location x="165872" y="80404" minz="-2464" maxz="-1864" />
			<location x="167452" y="84012" minz="-2464" maxz="-1864" />
			<location x="165600" y="85244" minz="-2464" maxz="-1864" />
			<location x="164092" y="83200" minz="-2464" maxz="-1864" />
		</territory>
		<npc id="20643" count="1" respawn="23" />	
		<npc id="20644" count="2" respawn="23" />	
		<npc id="20645" count="1" respawn="23" />	
	</spawn>
	<spawn name="[aden10_2520_06]">
		<territory>	
			<location x="165740" y="85248" minz="-2456" maxz="-1456" />
			<location x="167440" y="84144" minz="-2456" maxz="-1456" />
			<location x="168116" y="85428" minz="-2456" maxz="-1456" />
			<location x="168104" y="86360" minz="-2456" maxz="-1456" />
			<location x="167248" y="87112" minz="-2456" maxz="-1456" />
			<location x="165180" y="87152" minz="-2456" maxz="-1456" />
		</territory>
		<npc id="20643" count="1" respawn="23" />	
		<npc id="20644" count="2" respawn="23" />	
		<npc id="20645" count="1" respawn="23" />	
	</spawn>
	<spawn name="[aden10_2520_07]">
		<territory>	
			<location x="165084" y="87168" minz="-2472" maxz="-2072" />
			<location x="166520" y="87708" minz="-2472" maxz="-2072" />
			<location x="166500" y="88852" minz="-2472" maxz="-2072" />
			<location x="166092" y="89056" minz="-2472" maxz="-2072" />
			<location x="164792" y="88724" minz="-2472" maxz="-2072" />
		</territory>
		<npc id="20643" count="1" respawn="23" />	
		<npc id="20644" count="1" respawn="23" />	
		<npc id="20645" count="1" respawn="23" />	
	</spawn>
	<spawn name="[aden10_2520_08]">
		<territory>	
			<location x="164016" y="84076" minz="-2472" maxz="-2072" />
			<location x="165680" y="85860" minz="-2472" maxz="-2072" />
			<location x="165200" y="87056" minz="-2472" maxz="-2072" />
			<location x="163992" y="85836" minz="-2472" maxz="-2072" />
		</territory>
		<npc id="20643" count="1" respawn="23" />	
		<npc id="20644" count="1" respawn="23" />	
		<npc id="20645" count="1" respawn="23" />	
	</spawn>
	<spawn name="[aden10_2520_09]">
		<territory>	
			<location x="163968" y="86276" minz="-2800" maxz="-2350" />
			<location x="164848" y="87272" minz="-2800" maxz="-2350" />
			<location x="164444" y="88740" minz="-2800" maxz="-2350" />
			<location x="163980" y="88340" minz="-2800" maxz="-2350" />
		</territory>
		<npc id="20643" count="1" respawn="23" />	
		<npc id="20644" count="1" respawn="23" />	
		<npc id="20645" count="1" respawn="23" />	
	</spawn>
	<spawn name="[aden11_mb2520_01]">
		<territory>	
			<location x="170212" y="84744" minz="-2052" maxz="-1452" />
			<location x="171056" y="85260" minz="-2052" maxz="-1452" />
			<location x="171016" y="85976" minz="-2052" maxz="-1452" />
			<location x="170232" y="85392" minz="-2052" maxz="-1452" />
		</territory>
		<npc id="25125" count="1" respawn="129600" respawn_rand="86400" />	
	</spawn>
	<spawn name="[aden11_mb2520_02]">
		<territory>	
			<location x="164740" y="93772" minz="-3260" maxz="-2660" />
			<location x="165392" y="93248" minz="-3260" maxz="-2660" />
			<location x="166108" y="93876" minz="-3260" maxz="-2660" />
			<location x="165392" y="94488" minz="-3260" maxz="-2660" />
		</territory>
		<npc id="25089" count="1" respawn="129600" respawn_rand="86400" />	
	</spawn>
	<spawn name="[aden11_mb2520_03]">
		<territory>	
			<location x="165504" y="87576" minz="-2464" maxz="-1864" />
			<location x="166328" y="87704" minz="-2464" maxz="-1864" />
			<location x="166384" y="88744" minz="-2464" maxz="-1864" />
			<location x="165604" y="88784" minz="-2464" maxz="-1864" />
		</territory>
		<npc id="25241" count="1" respawn="129600" respawn_rand="86400" />	
	</spawn>
	<spawn name="[aden10_mb2520_04]">
		<territory>	
			<location x="165596" y="68480" minz="-3348" maxz="-2748" />
			<location x="166052" y="67440" minz="-3348" maxz="-2748" />
			<location x="166928" y="68124" minz="-3348" maxz="-2748" />
			<location x="166244" y="69028" minz="-3348" maxz="-2748" />
		</territory>
		<npc id="25463" count="1" respawn="129600" respawn_rand="86400" />	
	</spawn>
	<spawn name="[aden10_tb2520_03]" event_name="[treasure_box]">
		<territory>	
			<location x="164036" y="69844" minz="-3172" maxz="-2822" />
			<location x="166152" y="70024" minz="-3172" maxz="-2822" />
			<location x="166604" y="72564" minz="-3172" maxz="-2822" />
			<location x="165796" y="73504" minz="-3172" maxz="-2822" />
			<location x="164032" y="73700" minz="-3172" maxz="-2822" />
		</territory>
		<npc id="18276" count="2" respawn="60" />	
		<npc id="21812" count="2" respawn="60" />	
	</spawn>
	<spawn name="[aden10_tb2520_04]" event_name="[treasure_box]">
		<territory>	
			<location x="164120" y="74116" minz="-3164" maxz="-2064" />
			<location x="165344" y="73908" minz="-3164" maxz="-2064" />
			<location x="166740" y="76632" minz="-3164" maxz="-2064" />
			<location x="166404" y="80164" minz="-3164" maxz="-2064" />
			<location x="163956" y="80052" minz="-3164" maxz="-2064" />
		</territory>
		<npc id="18276" count="1" respawn="60" />	
		<npc id="21812" count="1" respawn="60" />	
	</spawn>

</list>